Name,Price,Description
Boss Commercial Grade Ergonomic Mesh High-Back Task Chair With Arms,$119.99,Boss Commercial Grade Ergonomic Mesh High-Back Task Chair With Arms, Black
Mind Reader Ergonomic Mesh Mid-Back Rolling Office Chair,$119.99,Mind Reader Ergonomic Mesh Mid-Back Rolling Office Chair, Black
Serta® Essentials Mid-Back Computer Chair,$119.99,Serta® Essentials Mid-Back Computer Chair, Productivity Gray/Chrome
Boss Office Products Budget Ergonomic Mid-Back Chair,$139.99,Boss Office Products Budget Ergonomic Mid-Back Chair, Black
Flash Furniture Ergonomic Mesh High-Back Office Chair,$168.99,Flash Furniture Ergonomic Mesh High-Back Office Chair, Gray
ALPHA HOME Mesh Swivel Office Task Chair With Headrest,$179.99,ALPHA HOME Mesh Swivel Office Task Chair With Headrest, Black
Serta® Executive Office Ergonomic Microfiber Mid-Back Chair,$199.99,Serta® Executive Office Ergonomic Microfiber Mid-Back Chair, Light Beige/Black
OFM Essentials 3-Paddle Ergonomic Mesh High-Back Chair,$249.99,OFM Essentials 3-Paddle Ergonomic Mesh High-Back Chair, Black/Silver
Serta® Smart Layers™ Siena Bonded Leather Mid-Back Manager's Chair,$249.99,Serta® Smart Layers™ Siena Bonded Leather Mid-Back Manager's Chair, Brown Free Store Pickup in 20 Minutes Order by 5pm and get it today
Realspace® Levari Faux Leather Mid-Back Task Chair,$299.99,Realspace® Levari Faux Leather Mid-Back Task Chair, Gray/Black Free Store Pickup in 20 Minutes Order by 5pm and get it today
